{
  "id": 100000020,
  "name": "Ancient Red-Eyes Dark Dragoon",
  "is_illegal": false,
  "is_custom": true,
  "text": "Ancient Dark Magician + Ancient Red-Eyes B. Dragon + Red-Eyes Dark Dragoon\nThis card must first be Fusion Summoned or summoned by the effect of \"Ancient Power Released\". This card is unaffected by card effects, unless they target this card. While this card is on the field or in the GY, it cannot be banished. If this card is Special Summoned, you can discard 1 \"Ancient Inferno Fire Blast\"; Inflict 4000 damage to the opponent\u0027s LP. Twice per turn, you can target 1 card your opponent controls; Destroy it, then if it is a monster, inflict damage to your opponent\u0027s LP equal to that monster\u0027s original ATK. If your opponent activates a card or effect, you can discard 1 card; (Quick Effect) negate that card or effect and destroy it, and if you do, this card gains 1000 ATK and DEF. You can only use this effect of \"Ancient Red-Eyes Dark Dragoon\" once per turn. If this card leaves the field by an opponent\u0027s card effect, during the End Phase of this turn: Banish all cards your opponent controls.",
  "images": [
    "https://www.dropbox.com/scl/fi/3qxjmm5ta9kykf9pt39wm/100000020.jpeg?rlkey=58ycrwbunz0xy7f5axeyqb5uc&st=rfundeci&dl=1"
  ],
  "type": "Monster",
  "attribute": "DARK",
  "atk": 4000,
  "species": "Spellcaster/Omni",
  "monster_type": "Fusion",
  "is_pendulum": false,
  "ability": "",
  "has_effect": true,
  "def": 4000,
  "level": 12,
  "is_tuner": false
}
